{
  "name": "claude-essentials",
  "description": "Community plugins for Claude Code: workflows, agents, audits, code review, documentation, development practices, research and model behavior. Independent community project, not affiliated with or endorsed by Anthropic.",
  "owner": {
    "name": "Nery Samuel Murillo",
    "email": "nerymurillohnd@gmail.com",
    "url": "https://github.com/nerymurillohnd/claude-essentials"
  },
  "plugins": [
    {
      "name": "svelte-development",
      "source": "./plugins/svelte-development",
      "description": "Svelte 5 and SvelteKit 3 development that also respects SvelteKit 2 projects: current best practices, docs lookup and autofixer, language-server navigation with renames proven by the project check, an editor and an auditor agent, a post-edit autofixer reminder, and the Svelte MCP and language servers, built on the Svelte team's AI tools.",
      "category": "development",
      "tags": ["svelte", "sveltekit", "astro", "tailwindcss", "mcp", "lsp"]
    }
  ],
  "renames": {
    "hello-example": null
  }
}
